{
  "audit_digest": "7c08917b9d745e81b4c80ad1633f29bd26f2de8523af2088e0dea3987e44f9b8",
  "audit_status": "Complete",
  "detector_limits": [
    "模态冲突机检只确认规范化命题完全一致的相反模态；同义改写由独立人工复核补充",
    "Authority机检覆盖唯一事实源重复声明与显式优先级循环；隐式Scope/时效/主体冲突由独立人工复核补充",
    "定义差异先作为候选，不由机器自行判断兼容扩展或语义冲突",
    "消费项目 runtime-only 模式验证 Manifest、内嵌快照和任务来源边界；规范编辑仓 Authority 对账只在发布审计执行"
  ],
  "findings": [
    {
      "category": "task_contract_snapshot_not_applicable",
      "evidence": "no --task-id supplied",
      "finding_id": "NCF-0001",
      "impact": "本次审计只覆盖受保护运行资产，不证明输入属于某个任务冻结的来源集合",
      "line_end": null,
      "line_start": null,
      "logical_path": ".project-governance/tasks/RUNTIME-ONLY/before.json",
      "message": "审计未绑定任务，跳过冻结 TaskContract 校验",
      "related_sources": [],
      "remediation_class": "not-applicable",
      "requires_human_decision": false,
      "severity": "Observation",
      "source_id": "RUNTIME-ONLY"
    }
  ],
  "generated_at": "2026-10-23T08:41:07.808320Z",
  "generator": {
    "path": "run-governed-product-workflow/scripts/audit_norm_consistency.py",
    "sha256": "c61b758c0944c39d0d65882aff7e899c221b7be62a55bd0907ee7f914f9dd094"
  },
  "inputs": {
    "auditor_sha256": "c61b758c0944c39d0d65882aff7e899c221b7be62a55bd0907ee7f914f9dd094",
    "manifest_sha256": "eb899c9e535c311f632d726e488004cbbc96007948590971387e09014005a34d",
    "normative_sources_sha256": "43c0990e110fec3ae97a99bd2fc7b43a31c5786e21f9ce7b8876811c87efb3ac",
    "profile_meta_map_sha256": "7b67698ee0cdadfeddf5e9216b165a128622dff54efe4ad84f150876e77e6f5c",
    "protected_asset_sha256": {
      "assets/runtime/evaluations/norm-retrieval-budgets.json": "d6b3c7ba1434427ef857d69a19c30a05bded3db0068ac25d2054bbc9fa21f54a",
      "assets/runtime/evaluations/norm-retrieval-gold.json": "77607c4a67e91751f2bedb15b3e2b822bb2a4257d3cb18dc459b812fd21c587c",
      "assets/runtime/mappings/norm-action-taxonomy.json": "d814fc5a9ccf0cc6e547f3a23d534d3100039d73dca59cdc23fbe819bc8b3882",
      "assets/runtime/mappings/profile-meta-map.json": "7b67698ee0cdadfeddf5e9216b165a128622dff54efe4ad84f150876e77e6f5c",
      "assets/runtime/mappings/tailoring-applicability-map.json": "d7abae34423493620a86aa8f1533a977dbe4b3e612f773fadea4ec83fc6d6eee",
      "assets/runtime/norms/01_治理基线/Vibe_Coding_P2裁剪与扩展规范适用性决议_V6.3.md": "30ea3d582201f35b1cb0e408129eb439bd49d94c6ec521dbc6682cb58ad517bd",
      "assets/runtime/norms/01_治理基线/Vibe_Coding_任务类型裁剪与统一执行流程规范_V6.3.md": "548a810a1cbce4fc7970f87778c71f56c9d0921e3ba385a73d085b8ed0276329",
      "assets/runtime/norms/01_治理基线/Vibe_Coding_公共术语与规范性用语基线_V6.3.md": "79fd8f6eaf64bf8f153afa2ae75bcf97c1479f31553ce6b218bb64fe6b1696e0",
      "assets/runtime/norms/01_治理基线/Vibe_Coding_受控产物目录与状态模型_V6.3.md": "c1a4d23a10810d47cff41620e3d305597106b71fbd0365136277159ff3e5eece",
      "assets/runtime/norms/02_核心规范/C01_Product_Discovery_Evidence_and_Intent_Standard.md": "afd73ffbde490eb2774af346046034692c83093612d0d60e0649cae8744c1773",
      "assets/runtime/norms/02_核心规范/C02_Initiative_and_Scope_Standard.md": "41a07e3f463fc41086114782bb6805a83ba0fd3a6968a4d8bdf1b7330a91a850",
      "assets/runtime/norms/02_核心规范/C03_PRD_and_Feature_Standard.md": "3a758c17120b4af03786ee86c842b6a4c03eed7a2103f2b376f0ab595dcb9107",
      "assets/runtime/norms/02_核心规范/C04_Atomic_Requirement_and_Evolution_Standard.md": "fcd2ddd5b49b3dd16f66efb4bb4355eab21d0f4612f4b3e340446fcca60a08b2",
      "assets/runtime/norms/02_核心规范/C05_Acceptance_Verification_and_Validation_Standard.md": "7973bcb4ea442030772e36b7418cc1e03f55e0b3aaa6072f4ec1c198d1b537c7",
      "assets/runtime/norms/02_核心规范/C06_UX_and_Technical_Design_Standard.md": "8b87093accc35af8562178dc095e388aef6b8468bed6e3615cdb695eb0392906",
      "assets/runtime/norms/02_核心规范/C07_Human_Agent_Collaboration_Standard.md": "a1fc4e903d8b690f938d6e8fdf45a57abff2e94bcefbdb9729db1914804f016a",
      "assets/runtime/norms/02_核心规范/C08_Agent_Context_Governance_Standard.md": "262f2a190f130cb97955e58fca57d2216e2edf949d2f271413e5dff5d6faeb6d",
      "assets/runtime/norms/02_核心规范/C09_Agent_Execution_and_Evidence_Standard.md": "6897694e362bf48cb3a13bb4e68d79d7173945daad2ba3e8f0b6c75be944c01e",
      "assets/runtime/norms/02_核心规范/C10_Decision_Traceability_and_Lineage_Standard.md": "0eba391e52d509b37f7e6882b631729627eee8d27a887ccf391c58cc8e6a7534",
      "assets/runtime/norms/02_核心规范/C11_Configuration_Version_Baseline_and_Change_Standard.md": "88ec56f78f6d3da6f94b1684c7b1296ed1825bfcc961f0f8d3636c8c6a26f7e1",
      "assets/runtime/norms/02_核心规范/C12_Review_Quality_Gate_and_Product_Health_Standard.md": "508ab6263bb1db5b1568cb16233ce7413a51da2f73bbe9eb39a56c9ad08d5565",
      "assets/runtime/norms/03_扩展规范/E01_Architecture_Governance_Extension_Standard.md": "ff37e13d26782b9d926835f82c84bb73719c81ffa6b835cf3e2ac742e90e611a",
      "assets/runtime/norms/03_扩展规范/E02_Security_Privacy_and_Compliance_Extension_Standard.md": "7353dcc98f73b6f68d9fb90ab1d0ed4e9ede362d1fcd9c4106685d68b7f57ebd",
      "assets/runtime/norms/03_扩展规范/E03_Data_and_AI_Data_Governance_Extension_Standard.md": "bb6a10422c6e672f3f67e6dc109c5bfaa594b195924758b21911fe44a18c603b",
      "assets/runtime/norms/03_扩展规范/E04_Knowledge_and_Records_Governance_Extension_Standard.md": "8cb8a7b01cec9b1c868a1cba27352fef1c6314ff85f1956072af6dee9eeabdf0",
      "assets/runtime/norms/03_扩展规范/E05_Product_Operations_and_Service_Management_Extension_Standard.md": "326d746628fd6b214527cd28ca71b5ea7b12148d4a0c102efcb0fb43f5c677da",
      "assets/runtime/norms/05_记录与登记册/V6.3_跨规范产物归属索引.md": "7de946e2b8804e84de13871719fa603598d93a6880cdbf25f127a5cc124a7682",
      "assets/runtime/schemas/authority-asset.schema.json": "0d578d67a124a9e432f09828661d6e123e027b3a32c168626d2eb8ab9c15c51a",
      "assets/runtime/schemas/derived-view.schema.json": "91c93a759081eafdd3b082471efd91c87dc7b65ee4363098f237f9d58987dade",
      "assets/runtime/schemas/minimal-task-record.schema.json": "ccd165e08d6cc6cad1f26b4a25a2ae70c36cc8df2a814f1c3f4d7c70c8fbe86f",
      "assets/runtime/schemas/norm-consistency-report.schema.json": "d8a2bc5c29f111e1d5d45cd1dcf8078b6dc1ca974d8a96360527bc1cd8563611",
      "assets/runtime/schemas/norm-index-metadata.schema.json": "aa3984e3e6f0ac43728fb8efd73d90e6528e803a0ac9a8a1f806d94429edbc9e",
      "assets/runtime/schemas/norm-query-result.schema.json": "5e000963dce586ffb3bb027da899470245aa90eb3d206217ede9640ee1a174cf",
      "assets/runtime/schemas/norm-query.schema.json": "18a00d1808aa76fb9b70d5425afc8081eeb1a05a95e063847e1e86ca3d06b106",
      "assets/runtime/schemas/project-state.schema.json": "5e57cb7a9f066af7fb09d666bf352b080efaa03c6394133b59da7b9242805e45",
      "assets/runtime/schemas/run-event.schema.json": "e7255dffcc97d5e20f99717818e6c642d064fc387cabfcd57c7f2a645ce8065e",
      "assets/runtime/schemas/task-after.schema.json": "93028764539c8af23116caa846d9cc58614ace73b316d4a35b449f1502e79e26",
      "assets/runtime/schemas/task-before.schema.json": "ad3db51c243bee235546c3093cba400fdb2227e7fc7e97dc2a4fc2d055672045"
    },
    "tailoring_map_sha256": "d7abae34423493620a86aa8f1533a977dbe4b3e612f773fadea4ec83fc6d6eee",
    "task_contract_bound": false,
    "task_contract_snapshot_verified": false
  },
  "manual_review_inventory": {
    "precedence_and_authority_claims": [
      {
        "line": 26,
        "logical_path": "references/02_核心规范/C01_Product_Discovery_Evidence_and_Intent_Standard.md",
        "source_id": "C01",
        "text": "> V6.3 元模型适配规则： 本规范列出的三位代码自 V6.3 起统一作为 legacy_kind/Domain Profile，不再作为正式顶层产物类型。本规范正文中历史表述“正式产物”“正式产物类型”均按“受控领域 Profile”解释；其专业语义、专属字段、领域状态和 Owner 保留。实例必须先归入 VC-PPG-COM-002 的六类元类型，再由 VC-PPG-MAP-001 解析 Profile。该规则优先于本规范正文中的 V6.2/V6.2.1 类型措辞，但不改变既有专业控制。"
      },
      {
        "line": 27,
        "logical_path": "references/02_核心规范/C02_Initiative_and_Scope_Standard.md",
        "source_id": "C02",
        "text": "> V6.3 元模型适配规则： 本规范列出的三位代码自 V6.3 起统一作为 legacy_kind/Domain Profile，不再作为正式顶层产物类型。本规范正文中历史表述“正式产物”“正式产物类型”均按“受控领域 Profile”解释；其专业语义、专属字段、领域状态和 Owner 保留。实例必须先归入 VC-PPG-COM-002 的六类元类型，再由 VC-PPG-MAP-001 解析 Profile。该规则优先于本规范正文中的 V6.2/V6.2.1 类型措辞，但不改变既有专业控制。"
      },
      {
        "line": 27,
        "logical_path": "references/02_核心规范/C03_PRD_and_Feature_Standard.md",
        "source_id": "C03",
        "text": "> V6.3 元模型适配规则： 本规范列出的三位代码自 V6.3 起统一作为 legacy_kind/Domain Profile，不再作为正式顶层产物类型。本规范正文中历史表述“正式产物”“正式产物类型”均按“受控领域 Profile”解释；其专业语义、专属字段、领域状态和 Owner 保留。实例必须先归入 VC-PPG-COM-002 的六类元类型，再由 VC-PPG-MAP-001 解析 Profile。该规则优先于本规范正文中的 V6.2/V6.2.1 类型措辞，但不改变既有专业控制。"
      },
      {
        "line": 112,
        "logical_path": "references/02_核心规范/C03_PRD_and_Feature_Standard.md",
        "source_id": "C03",
        "text": "| Product Dependency | PRD、Feature 或 Requirement 成立、实现、验证或发布所依赖的外部对象或条件 | 专业化自 C02 Dependency；冲突时以 C02 上游事实为准 |"
      },
      {
        "line": 198,
        "logical_path": "references/02_核心规范/C03_PRD_and_Feature_Standard.md",
        "source_id": "C03",
        "text": "| 信息 | 唯一事实源 | C03 允许动作 |"
      },
      {
        "line": 27,
        "logical_path": "references/02_核心规范/C04_Atomic_Requirement_and_Evolution_Standard.md",
        "source_id": "C04",
        "text": "> V6.3 元模型适配规则： 本规范列出的三位代码自 V6.3 起统一作为 legacy_kind/Domain Profile，不再作为正式顶层产物类型。本规范正文中历史表述“正式产物”“正式产物类型”均按“受控领域 Profile”解释；其专业语义、专属字段、领域状态和 Owner 保留。实例必须先归入 VC-PPG-COM-002 的六类元类型，再由 VC-PPG-MAP-001 解析 Profile。该规则优先于本规范正文中的 V6.2/V6.2.1 类型措辞，但不改变既有专业控制。"
      },
      {
        "line": 211,
        "logical_path": "references/02_核心规范/C04_Atomic_Requirement_and_Evolution_Standard.md",
        "source_id": "C04",
        "text": "| 信息 | 唯一事实源 | C04 允许动作 |"
      },
      {
        "line": 27,
        "logical_path": "references/02_核心规范/C05_Acceptance_Verification_and_Validation_Standard.md",
        "source_id": "C05",